{
  "entity_type": "resource",
  "schema_version": "1.0",
  "resource_id": "RES-WORKFLOW-001",
  "resource_title": "The Verified Local Business AI Content Production Workflow",
  "resource_type": "WORKFLOW_RESOURCE",
  "description": "An end-to-end operational framework for local service businesses to produce citation-backed, factual educational guides without medical or legal liability.",
  "problem": {
    "problem_statement": "Overcoming the high cost, slow turnaround, and factual hallucination risks of generic AI content generation for local service businesses.",
    "target_users": [
      "Local Business Owners",
      "Clinic Directors",
      "Marketing Strategists"
    ],
    "target_verticals": [
      "Healthcare",
      "Professional Services",
      "Home Services"
    ]
  },
  "workflow": {
    "workflow_name": "WF-AICONTENT-001",
    "workflow_stage": "End-to-End Production",
    "required_capabilities": [
      "CAP-RES-04",
      "CAP-BRF-01",
      "CAP-CRT-01",
      "CAP-REP-01",
      "CAP-MNT-01"
    ]
  },
  "related_tools": [
    "TOOL-CAN-001",
    "TOOL-CAN-004",
    "TOOL-CAN-006",
    "TOOL-CAN-007",
    "TOOL-CAN-011"
  ],
  "related_articles": [
    "ai-content-research-workflow-local-businesses",
    "ai-content-brief-workflow-local-businesses",
    "ai-content-repurposing-workflow-local-businesses"
  ],
  "related_learning_paths": [
    "lp02"
  ],
  "governance": {
    "last_reviewed": "2026-09-26",
    "review_status": "PUBLISHED",
    "reviewer": "LOCATRIA Editorial Governance Board",
    "change_notes": "Initial publication of canonical workflow resource for WF-AICONTENT-001."
  }
}
